{
  "$schema": "./compatibility.schema.json",
  "status": "verified",
  "checked_at": "2026-09-06",
  "runtime": {
    "node": "24.x",
    "pnpm": "10.33.1"
  },
  "frontend": {
    "next": "16.3.4",
    "react": "19.2.8",
    "bundler": "webpack"
  },
  "packages": {
    "starknet": "10.5.0",
    "get_starknet_discovery": "6.0.2",
    "get_starknet_wallet_standard": "6.0.2",
    "types_js": "0.10.3"
  },
  "strk20": {
    "route": "wallet-api",
    "minimum_wallet_api": "0.10.3",
    "supported_wallet": "Ready X 5.33.9",
    "network": "SN_MAIN",
    "pool_address": "0x040337b1af3c663e86e333bab5a4b28da8d4652a15a69beee2b677776ffe812a"
  },
  "verification": {
    "starter_matrix": "passed",
    "candidate_matrix": "passed",
    "browser_wallet": "passed"
  },
  "warnings": [
    "Ready X 5.33.9 with Wallet API 0.10.3 is the verified browser path; other wallets must pass the runtime preflight.",
    "Wallet responses are not trusted as final evidence until the receipt succeeds and an official-pool event is independently verified."
  ]
}
